{
  "run_id": "20260328T000000Z_AAPL_C",
  "created_at": "2026-03-28T00:00:00Z",
  "tickers": ["AAPL"],
  "artifact_layout": "output/runs/{run_id}/{ticker}/",
  "artifacts": {
    "AAPL": {
      "artifact_root": "output/runs/20260328T000000Z_AAPL_C/AAPL",
      "research_plan": "output/runs/20260328T000000Z_AAPL_C/AAPL/research-plan.json",
      "tier1_raw": "output/runs/20260328T000000Z_AAPL_C/AAPL/tier1-raw.json",
      "tier2_raw": "output/runs/20260328T000000Z_AAPL_C/AAPL/tier2-raw.json",
      "validated_data": "output/runs/20260328T000000Z_AAPL_C/AAPL/validated-data.json",
      "analysis_result": "output/runs/20260328T000000Z_AAPL_C/AAPL/analysis-result.json",
      "quality_report": "output/runs/20260328T000000Z_AAPL_C/AAPL/quality-report.json",
      "snapshot_dir": "output/data/AAPL",
      "reports_dir": "output/reports"
    }
  }
}
